{
  "meta": {
    "name": "Jeanpaul Garcia",
    "title": "AI Strategy Consultant",
    "tagline": "Helping Businesses Navigate the AI Transition",
    "email": "jg847@njit.edu",
    "linkedin": "https://www.linkedin.com/in/jeanpaul-garcia-724017293/"
  },
  "hero": {
    "headline": "Transform Your Business with AI",
    "subheadline": "Strategic guidance for teams adopting AI tools, workflows, and culture.",
    "cta_text": "Get in Touch",
    "cta_href": "#contact"
  },
  "services": [
    {
      "id": "training",
      "title": "AI Training",
      "description": "Hands-on workshops for teams at every level — from executives to engineers.",
      "icon": "🎓"
    },
    {
      "id": "strategy",
      "title": "Strategic Advisory",
      "description": "Roadmaps, vendor evaluation, and AI readiness assessments.",
      "icon": "🧭"
    },
    {
      "id": "development",
      "title": "Development Support",
      "description": "Technical guidance for integrating AI APIs and building AI-powered tools.",
      "icon": "⚙️"
    }
  ],
  "about": {
    "bio": "I am a senior at NJIT pursuing a bachelor's degree in web information systems. I help organizations move from AI curiosity to AI capability, working to expand my portfolio and improve my resume.",
    "highlights": [
      "Senior at NJIT",
      "Bachelor's degree in web information systems",
      "Specializes in helping organizations develop AI capability"
    ]
  },
  "contact": {
    "prompt": "Ready to start your AI journey? Get in touch with me via email or LinkedIn.",
    "form_action": "Contact: jg847@njit.edu | LinkedIn: https://www.linkedin.com/in/jeanpaul-garcia-724017293/"
  }
}